University of Michigan. Dept. of Industrial and Operations Engineering.,University of Michigan. Department of Industrial Engineering,http://id.loc.gov/authorities/names/n82218726
University of Michigan. Dept. of Library Science.,University of Michigan. School of Library Science,http://id.loc.gov/authorities/names/n81144007
"University of Michigan. Dept. of Literature, Science, and the Arts.",University of Michigan. Department of Philosophy,http://id.loc.gov/authorities/names/no2001024606
University of Michigan. Dept. of Mechanical Engineering   Applied Mechanics.,University of Michigan. Department of Mechanical Engineering & Applied Mechanics. Design Laboratory,http://id.loc.gov/authorities/names/nr92023965
University of Michigan. Dept. of Population Planning.,University of Michigan. School of Public Health. Department of Population Planning,http://id.loc.gov/authorities/names/no90025948
University of Michigan. Dept. of Psychology.,University of Michigan. Planaria Research Group,http://id.loc.gov/authorities/names/nr91042076
University of Michigan. Dept. of Surgery.,University of Michigan. Department of Medicine and Surgery,http://id.loc.gov/authorities/names/n85250563
University of Michigan. Division of Cardiology.,University of Michigan. Mott Children's Hospital. Division of Pediatric Cardiology,http://id.loc.gov/authorities/names/n2005183841
University of Michigan. Division of Kinesiology.,University of Michigan. Health Management Research Center,http://id.loc.gov/authorities/names/no99047899
University of Michigan. Division of Nuclear Medicine.,University of Michigan. Medical Center. Division of Nuclear Medicine,http://id.loc.gov/authorities/names/n89222960
University of Michigan. Gilbert and Sullivan Society.,Friends of the University of Michigan Gilbert and Sullivan Society,http://id.loc.gov/authorities/names/no98102017
University of Michigan. Gilbert and Sullivan Society. Friends.,Friends of the University of Michigan Gilbert and Sullivan Society,http://id.loc.gov/authorities/names/no98102017
University of Michigan. Graduate School.,University of Michigan. Graduate School of Business Administration,http://id.loc.gov/authorities/names/n79073704
University of Michigan. Hospital.,University of Michigan. Medical Center,http://id.loc.gov/authorities/names/n81102883
University of Michigan. Hospitals.,University of Michigan. University Hospital,http://id.loc.gov/authorities/names/n80123188
University of Michigan. Housing Division.,Michigan State University. Division of Housing & Food Services,http://id.loc.gov/authorities/names/n2009010767
University of Michigan. Industry Program.,University of Michigan Industry Affiliation Program for Human Factors in Transportation Safety,http://id.loc.gov/authorities/names/no2006083151
University of Michigan. Institute for Social Research.,University of Michigan. Survey Research Center,http://id.loc.gov/authorities/names/n79106618
University of Michigan. Institute of Industrial Health.,Institute of Labor and Industrial Relations (University of Michigan--Wayne State University). Worker Health Program,http://id.loc.gov/authorities/names/no2005089071
University of Michigan. Institute of Public Administration.,Michigan State University. Institute of Public Utilities,http://id.loc.gov/authorities/names/n80094485
University of Michigan. Institute of Science and Technology.,University of Michigan. Institute of Science and Technology. Industrial Development Division,http://id.loc.gov/authorities/names/n80138338
University of Michigan. International Center.,Michigan State University. Center for Advanced Study of International Development,http://id.loc.gov/authorities/names/n84023041
University of Michigan. Library Council.,History E-Book Project,http://id.loc.gov/authorities/names/no2004102841
University of Michigan. Library.,William L. Clements Library,http://id.loc.gov/authorities/names/n84017513
University of Michigan. Medical Center.,University of Michigan. Medical Center. Media Library,http://id.loc.gov/authorities/names/n81102884
University of Michigan. Medical Library.,University of Michigan. Medical Center. Media Library,http://id.loc.gov/authorities/names/n81102884
University of Michigan. Museums.,University of Michigan. University Museum,http://id.loc.gov/authorities/names/n84134481
University of Michigan. Office of Budgets and Planning.,Michigan State University. Office of Planning and Budgets,http://id.loc.gov/authorities/names/n87109541
University of Michigan. Office of International Programs.,Michigan State University. Office of International Studies and Programs,http://id.loc.gov/authorities/names/n2003075478
University of Michigan. Office of Medical Education.,Michigan State University. Office of Medical Education Research and Development,http://id.loc.gov/authorities/names/n80013823
University of Michigan. Office of Minority Affairs.,University of Michigan. Office of the Vice Provost for Minority Affairs,http://id.loc.gov/authorities/names/nr90017775
University of Michigan. Office of Student Affairs.,Michigan State University. Office of the Vice President of Student Affairs and Services,http://id.loc.gov/authorities/names/n87109540
University of Michigan. Office of Student Services.,Michigan State University. Office of the Vice President of Student Affairs and Services,http://id.loc.gov/authorities/names/n87109540
University of Michigan. Office of University Relations and Development.,University of Michigan. Office of Development and University Relations,http://id.loc.gov/authorities/names/n83201575
University of Michigan. Opportunity Program.,University of Michigan. Programs for Educational Opportunity,http://id.loc.gov/authorities/names/n90709792
University of Michigan. Orchestra.,University of Michigan. Symphony Orchestra,http://id.loc.gov/authorities/names/n78012545
University of Michigan. Presbyterian Corporation.,Tappan Presbyterian Association,http://id.loc.gov/authorities/names/no98101101
University of Michigan. President.,University of Michigan. President's Life Sciences Commission,http://id.loc.gov/authorities/names/nr99007603
University of Michigan. Provost.,University of Michigan. Office of the Vice Provost for Minority Affairs,http://id.loc.gov/authorities/names/nr90017775
University of Michigan. Radiation Laboratory.,University of Michigan. Department of Electrical and Computer Engineering. Radiation Laboratory,http://id.loc.gov/authorities/names/n80003626
University of Michigan. Research Club.,Women's Research Club (University of Michigan),http://id.loc.gov/authorities/names/n92081612
University of Michigan. Ross School of Business.,Michigan Ross School of Business,http://id.loc.gov/authorities/names/no2005067481
University of Michigan. School of Art   Design.,University of Michigan. College of Architecture and Design,http://id.loc.gov/authorities/names/n82166171
University of Michigan. School of Art and Design.,University of Michigan. College of Architecture and Design,http://id.loc.gov/authorities/names/n82166171
University of Michigan. School of Public Policy.,University of Michigan. Gerald R. Ford School of Public Policy,http://id.loc.gov/authorities/names/no2004120931
University of Michigan. Society of Alumni.,University of Michigan. Library Science Alumni Society,http://id.loc.gov/authorities/names/n87150761
University of Michigan. University College.,Michigan State University,http://id.loc.gov/authorities/names/n79054541
University of Michigan. University Council.,"Inter-Cooperative Council (Ann Arbor, Mich.)",http://id.loc.gov/authorities/names/nr94000463
University of Michigan. University Health Service.,University of Michigan. School of Public Health. Student Environmental Consulting Service,http://id.loc.gov/authorities/names/n90690702
University of Michigan. University Hospital.,University of Michigan. Medical Center,http://id.loc.gov/authorities/names/n81102883
University of Michigan. University Museum.,University of Michigan. Museum of Art,http://id.loc.gov/authorities/names/n80040326
University of Michigan. University Publications.,Western Michigan University. Medieval Institute Publications,http://id.loc.gov/authorities/names/no94020010
University of Michigan. University School.,University of Michigan. Law School,http://id.loc.gov/authorities/names/n82116981
University of Michigan. Vice Provost for Minority Affairs.,University of Michigan. Office of the Vice Provost for Minority Affairs,http://id.loc.gov/authorities/names/nr90017775
University of Michigan. Vice-President for Academic Affairs.,University of Michigan. Office of the Provost and Vice President for Academic Affairs,http://id.loc.gov/authorities/names/nr90017777
University of Michigan. Vice-President for Research.,University of Michigan. Office of the Vice President for Research,http://id.loc.gov/authorities/names/nr95004317
University of Michigan. Willow Run Laboratories.,University of Michigan. Center for Remote Sensing Information and Analysis,http://id.loc.gov/authorities/names/n82093628
University of Nashville.,Vanderbilt University. School of Engineering,http://id.loc.gov/authorities/names/n85000248
University of New Mexico. President.,University of New Mexico. Office of the President,http://id.loc.gov/authorities/names/no2002025649
University of Washington.,Catholic University of America,http://id.loc.gov/authorities/names/n80126110
University of the Philippines.,University of Santo Tomás,http://id.loc.gov/authorities/names/n81108961
Upjohn Company.,Pharmacia & Upjohn,http://id.loc.gov/authorities/names/no2010102337
"Veterans Administration Hospital (Ann Arbor, Mich.)","Veterans Administration Medical Center (Ann Arbor, Mich.)",http://id.loc.gov/authorities/names/n85202509
W. K. Kellogg Foundation Institute.,Conference on Recent Developments in Dental Ceramics (1983 : University of Michigan),http://id.loc.gov/authorities/names/n88609379
War Resisters League.,War Resisters' International,http://id.loc.gov/authorities/names/n50025176
Washtenaw County (Mich.),Washtenaw County Metropolitan Planning Commission,http://id.loc.gov/authorities/names/n85159002
Wayne County (Mich.),Wayne County Library,http://id.loc.gov/authorities/names/n82070464
Wayne County General Hospital.,"Eloise (Hospital : Wayne County, Mich.)",http://id.loc.gov/authorities/names/no2002050152
Wesco Corporation.,Wesco Tool & Manufacturing (Firm),http://id.loc.gov/authorities/names/no00063028
Western District Association.,New Haven West Association (Conn.),http://id.loc.gov/authorities/names/n86053708
Western Reserve University.,Franklin Thomas Backus School of Law,http://id.loc.gov/authorities/names/n82217350
Western and Atlantic Railroad Company.,Atlantic Coast Line Railroad Company,http://id.loc.gov/authorities/names/n85150533
Westinghouse Electric   Manufacturing Company.,Westinghouse Electric Corporation,http://id.loc.gov/authorities/names/n79100436
Whig Party (U.S.),Union and Southern Rights Party (U.S.),http://id.loc.gov/authorities/names/nr92009049
Willow Run Laboratories.,Environmental Research Institute of Michigan,http://id.loc.gov/authorities/names/n79067113
Wilson Ornithological Club.,Wilson Ornithological Society,http://id.loc.gov/authorities/names/n83134555
Woman's Peace Party.,Women's International League for Peace and Freedom,http://id.loc.gov/authorities/names/n50081271
World Power Conference.,International Commission on Large Dams,http://id.loc.gov/authorities/names/n79148832
Yerkes Observatory.,Center for Astrophysical Research in Antarctica (U.S.),http://id.loc.gov/authorities/names/n92033339
Young Men's Christian Association.,World Alliance of YMCAs,http://id.loc.gov/authorities/names/n80044742
Youth for Understanding (Organization),Suomen Youth for Understanding ry,http://id.loc.gov/authorities/names/n85153813
